{
  "schema": {
    "name": "nodegraph-construct-taxonomy",
    "version": "1.0.0"
  },
  "taxonomyVersion": 1,
  "constructs": [
    {
      "constructId": "construct_shared_leadership",
      "canonicalName": "shared leadership",
      "aliases": [
        "distributed leadership"
      ],
      "status": "approved",
      "reviewState": {
        "verification": {
          "source": "not-applicable",
          "interpretation": "verified",
          "classification": "verified"
        },
        "approval": {
          "researcher": "approved",
          "advisor": "not-reviewed"
        },
        "origin": "human"
      }
    },
    {
      "constructId": "construct_participative_leadership",
      "canonicalName": "participative leadership",
      "aliases": [],
      "status": "deprecated",
      "primaryConstructId": "construct_shared_leadership",
      "reviewState": {
        "verification": {
          "source": "not-applicable",
          "interpretation": "verified",
          "classification": "verified"
        },
        "approval": {
          "researcher": "approved",
          "advisor": "not-reviewed"
        },
        "origin": "human"
      }
    }
  ],
  "modified": "2026-07-30T12:00:00Z"
}
